<?xml version="1.0" encoding="UTF-8"?>

<alumnos xmlns:xsi="http://www.w3.org/2001/XMLSchema-instance" xsi:noNamespaceSchemaLocation="https://github.com/andrespena9010/XML/raw/main/alumnos.xsd">
 <alumno dni="11771111A">
    <nombre>Juan Andrés</nombre>
    <direccion>
      <calle>Avenida de la Fuente</calle>
      <numero>6</numero>
      <ciudad>Zafra</ciudad>
      <provincia>Badajoz</provincia>
    </direccion>
    <telefono>924555555</telefono>
  </alumno>
  <alumno dni="11772211C">
    <nombre>Jose Sanchez</nombre>
    <direccion>
      <calle>Calle Ancha</calle>
      <numero>3</numero>
      <ciudad>Zafra</ciudad>
      <provincia>Badajoz</provincia>
    </direccion>
    <direccion>
      <calle>Calle Mayor</calle>
      <numero>33</numero>
      <ciudad>Zafra</ciudad>
      <provincia>Badajoz</provincia>
    </direccion>
    <telefono>924550000</telefono>
  </alumno>
</alumnos>
